FailingMethod,Answer.duration,Answer.confidence,Answer.difficulty,Answer.order,Answer.explanation,Code.LOC,Code.complexity,Worker.score,Worker.profession,Worker.yearsOfExperience,Worker.age,Worker.gender,Worker.country,Flesch_reading_ease,books,high school,no?,other,other as long as i can remember honestly,other at work,other autodidact,other books,other by myself from books,other diploma,other elementary school,other employer,other first robotics,other forever,other found a book,other had a book on basic when i was a kid,other hobby,other hobbyist,other i really dont remember a time when i couldnt,other instructional books,other java while on the job,other junior high computer class,other leanred more experts at work,other middle school,other mooc,other na,other on the job,other private,other private institute,other professional,other professionally,other self help books,other self study,other self taught,other self-study,other self-taught,other self-taught as a child,other summer camp,other taught myself the basics as a kid,other through work,other training classes,other us army,other when i started programming (at age 9),other work,"there was no ""internet"". i had a trs-80 for gosh sake. we learned from books! made of paper. odd concept",university,web,Unnamed: 66,.net,3,5,6,a little bit of java,ada,ahk,ajax,asp,asp.net,assembly,autoit,bash,bash and powershell,basic,c,c sharp,c#,c# vb.net java,c+,c++,c++ and python,c/c++,c/c++ and some python and java,css,css3,cuda,developing,do not currently use,dot net and core java,elixir,euphoria,go,groovy,html,html/css (formerly c# and java in previous jobs),html5,jav,java,java c++,java python,javascript,jee,js,jsp,magic,matlab,most c and ksh in past,mql4,mysql,none,none at present,object pascal,peoplesoft,perl,php,php and c++,php/javascript,pl/sql,plsql,python,r,rpg,ruby,ruby & javascript,ruby on rails,sas,scala,scheme,sql,sql (teradata/ms-sql),swift,tera data,various,vb .net java,vb.net,vba,vbs,vbscript,vhdl,visual basic,visual fox pro,visual foxpro,visualbasic,xml,semantic_similarity,readability_score
54,-0.0971809315319625,0.9803391241696182,-1.5819408399854256,-1.157490915565446,The country code is missing. Or rather lines 115/117 are looking at '_P' and the underscore fails the validation.,0.1528291076267358,0.0995954435056861,-1.425594061756673,3,1.7387488388711585,1.440137782209301,1,21,78.75,0,1,0,0,0,0,0,0,0,0,0,0,0,0,0,0,0,0,0,0,0,0,0,0,0,0,0,0,0,0,0,0,0,0,0,0,0,0,0,0,0,0,0,0,0,1,0,0,0,0,0,0,0,0,0,0,0,0,0,0,0,0,0,0,0,0,0,0,0,0,0,0,0,0,0,0,0,0,0,0,0,0,0,0,0,0,0,0,0,0,0,0,0,0,0,0,0,0,0,0,0,0,0,0,0,0,0,0,0,0,1,0,0,0,0,0,0,0,0,0,0,0,0,0,0,0,0,0,1,0,0,0,0,0.6458998918533325,78.75
35,-0.3045117235820768,0.9803391241696182,-0.0061078796910634,0.0806212578005783,The inferred type for the array is Object. However; sa which will be bound to the return value has a type of String[]. As the error message states Java can not cast an Object array to a String array.,-0.4537848887993849,-0.4843960206867461,1.0142286111005188,1,0.5333932206623858,0.8904993978749821,1,23,83.66,0,0,0,0,0,0,0,0,0,0,0,0,0,0,0,0,0,0,0,0,0,0,0,0,0,0,0,0,0,0,0,0,0,0,0,0,0,0,0,0,0,0,0,0,0,0,1,0,0,0,0,0,0,0,0,0,0,0,0,0,0,0,0,0,0,0,0,0,0,0,0,0,0,0,0,0,0,0,1,0,0,0,0,0,0,0,0,0,0,0,0,0,0,0,0,0,0,0,0,0,0,0,0,0,0,0,0,0,1,0,0,0,0,0,0,0,0,0,0,0,0,0,0,0,0,0,0,0,0,0,0,0,0,0.5358076095581055,83.66
8,-0.2238568425549819,0.9803391241696182,0.7818086004561177,0.0806212578005783,The argument -15 is less than 0; which causes the if statement conditional on line 279 to pass. This results in the exception on line 280 being thrown. According to the comment block above the method; minutesOffset should be checked for below -59 or above 59.,0.1528291076267358,0.0995954435056861,1.0142286111005188,3,-0.1898201502628776,-0.7584157551279755,1,22,72.87,0,1,0,0,0,0,0,0,0,0,0,0,0,0,0,0,0,0,0,0,0,0,0,0,0,0,0,0,0,0,0,0,0,0,0,0,0,0,0,0,0,0,0,0,0,1,1,0,0,0,0,0,0,0,0,0,0,0,0,0,0,0,0,0,0,0,0,0,1,0,0,0,0,0,0,0,0,0,0,0,0,0,0,0,0,0,1,0,0,0,0,0,0,0,0,0,0,0,0,0,0,0,0,1,0,0,0,0,0,0,0,0,0,0,0,0,0,0,0,0,0,0,0,0,0,0,0,0,0,0,0,0,0,0.7879222631454468,72.87
8,-0.1720975106717197,-0.2540556734670899,-0.0061078796910634,1.3187334311666028,This variable contains a value of -15 as set by DateTimeZone.forOffsetHoursMinutes(-2; -15). Line 279 checks to see if is a valid value; meaning that is between 0 and 59. Since it is not; an exception error is thrown in line 280.,-0.4537848887993849,-0.4843960206867461,1.0142286111005188,1,-0.9130335211881412,-0.0988496939267924,0,33,74.49,0,0,0,0,0,0,0,0,0,0,0,0,0,0,0,0,0,0,0,0,0,0,0,0,0,0,0,0,0,0,0,0,0,0,0,0,0,0,0,0,0,0,0,0,0,1,0,0,0,0,0,0,0,0,0,0,0,0,0,0,0,0,0,0,0,0,0,0,0,0,0,0,0,0,0,0,0,0,0,0,0,0,0,0,0,0,0,0,0,0,0,0,0,0,0,0,0,0,1,0,0,0,0,0,0,0,0,0,0,0,0,0,0,0,0,0,0,0,0,0,0,0,0,0,0,0,0,0,0,0,0,0,0,0.703960657119751,74.49
24,-0.3782481471317471,0.3631417253512641,-0.7940243598382445,0.0806212578005783,The exception is coming from Color; so it must be g that has a bad value.  I need to see the definition of this.lowerBound and this.upperBound to know what is wrong though.,-0.4537848887993849,-0.4843960206867461,-0.205682725328077,3,-0.3103557120837548,0.0110779829400713,0,6,80.28,0,0,0,0,0,0,0,0,0,0,0,0,0,0,0,0,0,0,0,0,0,0,0,0,0,0,0,0,0,0,0,0,0,0,0,0,0,0,0,0,0,0,0,0,0,1,1,0,0,0,0,0,0,0,0,0,0,0,0,0,0,0,0,0,0,0,0,0,0,0,0,0,0,0,0,0,0,0,0,0,0,0,0,0,0,0,0,0,0,0,0,0,0,0,0,0,0,1,0,0,0,0,0,1,0,0,0,0,0,0,0,0,0,0,0,0,0,0,0,0,0,0,0,0,0,0,0,0,0,0,0,0,0,0.7867826819419861,80.28
